{
  "schemaVersion": "content-0",
  "id": "original:glade",
  "name": "Mosslight Glade",
  "width": 8,
  "height": 8,
  "encounters": [
    "original:glade-edge"
  ],
  "navigation": {
    "vertices": [
      {
        "x": 0,
        "y": 0,
        "z": 0
      },
      {
        "x": 8192,
        "y": 0,
        "z": 0
      },
      {
        "x": 0,
        "y": 0,
        "z": 8192
      }
    ],
    "faces": [
      [
        0,
        1,
        2
      ]
    ],
    "links": []
  },
  "encounterRegions": [
    {
      "id": "original:glade-patch",
      "encounter": "original:glade-edge",
      "faces": [
        0
      ]
    }
  ],
  "npcs": [
    {
      "id": "original:guide",
      "name": "Glade Guide",
      "x": 2048,
      "y": 0,
      "z": 1024,
      "dialogue": "original:welcome"
    }
  ]
}
